Title,url,Thumbnail url,Channel,Description
The Super Mario Bros. Movie Direct – 11.29.2022 (Second Trailer),https://www.youtube.com/watch?v=ohJrpHUoZ10,,Nintendo of America,Watch the latest Nintendo Direct presentation to see the world premiere of The Super Mario Bros. Movie’s second trailer! No game information will be included in this Nintendo Direct. #SuperMario...
That '90s Show | Official Teaser | Netflix,https://www.youtube.com/watch?v=jOpoPPIRtdQ,,Netflix,"Welcome back to your favorite basement. Same Formans, new friends. It’s 1995 and Leia Forman, daughter of Eric and Donna, is visiting her grandparents for the summer, where she bonds with..."
ITZY “Cheshire” M/V @ITZY,https://www.youtube.com/watch?v=zugAhfd2r0g,,JYP Entertainment,ITZY “Cheshire” M/V 🎧 TITLE http://kko.to/OACKMtlBJg 💿 PRE-SAVE & PRE-ORDER https://ITZY.lnk.to/CHESHIRE [ITZY Official] ▶ https://www.youtube.com/c/ITZY ▶ https://www.instagram.com...
I found the best TIKTOKS,https://www.youtube.com/watch?v=-tpND_8cak4,,LazarLazar,🕹️ Download now for FREE: https://operagx.gg/LazarLazar Sponsored by Opera. Opera GX gives you complete CONTROL over your RAM & CPU usage. Kill CPU-draining tabs! 👕LAZAR Merch -...
space.,https://www.youtube.com/watch?v=MST-0jsOTN0,,Incognito Mode,Go to https://BuyRaycon.com/incognito for 20% off sitewide! Brought to you by Raycon. -------------------------------------------------- Ordinary Things: https://youtu.be/JEJ9Q3sUg3Q -------------...
Season 2 Trailer | Overwatch 2,https://www.youtube.com/watch?v=rEJVOxzjyQ0,,PlayOverwatch,"The battle gets bigger in Season 2! On December 6, Overwatch 2’s first tempo tank Ramattra joins the fray, taking down enemies with his dynamic and lethal ability kit. Battle with or..."
Metro Boomin - Heroes & Villains (Short Film),https://www.youtube.com/watch?v=uI29qCR9PGk,,Metro Boomin,Pre-Save Heroes & Villains: https://MetroBoomin.lnk.to/HeroesandVillains Connect with Metro Boomin: https://twitter.com/metroboomin https://www.instagram.com/metroboomin/ https://www.instagram.com...
"Nas ft. @21 Savage - One Mic, One Gun (Official Audio)",https://www.youtube.com/watch?v=VMZefv4Vrwg,,Nas,"Nas ft. @21 Savage - One Mic, One Gun (Official Audio) King's Disease III Available Now 👑 Download/Stream King's Disease III https://nas.lnk.to/kd3 -----------------Nas-----------------..."
"Billie Eilish: Same Interview, The Sixth Year | Vanity Fair",https://www.youtube.com/watch?v=55XJ1ObZKaM,,Vanity Fair,"""I feel hopeful and I feel happy and I feel in a good spot in my life right now."" We've spent the last six years following Billie Eilish on her journey through pop superstardom. Was 2022 her..."
[2022 MAMA] IVE&Kep1er&NMIXX&LESSERAFIM&NewJeans-ELEVEN+WADADA+O.O+FEARLESS+HypeBoy | Mnet 221129 방송,https://www.youtube.com/watch?v=IJks7TIDfnk,,Mnet K-POP,티빙에서 스트리밍 : https://tving.onelink.me/xHqC/30a78d6f 'LINNK the next generation' ELEVEN + WADADA + O.O + FEARLESS + Hype Boy by IVE&Kep1er&NMIXX&LE SSERAFIM&NewJeans in 2022...
Can you beat two Mario games with ONE controller?,https://www.youtube.com/watch?v=C05Ldt9hDqs,,DougDoug,Get my Youtooz here! https://youtooz.com/products/chef-dougdoug This was streamed live on Twitch! https://bit.ly/DougTwitch Full stream recording: Edited by Berry Bebop! https://www.youtube.com/...
Pokemon Violet is a stable game with no glitches at all,https://www.youtube.com/watch?v=yuLP8zSq4HY,,PointCrow,"Pokemon Scarlet and Violet -- the new Generation 9 Pokemon games, are absolutely ridiculously broken. So, I decided to do a playthrough of the games while attempting to break the game in every..."
[2022 MAMA] Stray Kids - a strange incident+VENOM(MAMA ver.)+I AM MANIAC+MANIAC | Mnet 221129 방송,https://www.youtube.com/watch?v=0QKhAdN-keY,,Mnet K-POP,티빙에서 스트리밍 : https://tving.onelink.me/xHqC/30a78d6f 'Do you want to be ODDINARY?' a strange incident + VENOM (MAMA ver.) + I AM MANIAC + MANIAC by Stray Kids in 2022 MAMA AWARDS...
SUPER MARIO BROS. MOVIE TRAILER 2 REACTION!! Mario Kart | Donkey Kong | Nintendo 2023 Official,https://www.youtube.com/watch?v=XvvLmQJRsxA,,Reel Rejects,"THIS LOOKS SO AWESOME! The Super Marios Bros. Movie Official Trailer 2 Reaction & Review features plenty of EASTER EGGS & characters including Luigi, Bowser, Princess Peach, Donkey Kong, Toad,..."
Talking to Sam Bankman Fried,https://www.youtube.com/watch?v=0rL35_WV3lE,,Coffeezilla,"Sam Bankman Fried was interviewed on 11/16 and I worked with Tiffany Fong to release the audio, fact-check and comment on the contents of the interview. Listen to the full call here: https://youtu..."
WATER TESTING 64 Person Enclosed Lifeboat For The FIRST Time!!,https://www.youtube.com/watch?v=N7WkXkZKCkg,,AYO Fishing,Go to https://buyraycon.com/ayofishing for 20% off sitewide! Brought to you by Raycon. JOB DETAILS: -must be 18+ -must be willing to move to Georgia if necessary -must have professional...
"""The Super Mario Bros. Movie"" Official Trailer REACTION!!!",https://www.youtube.com/watch?v=sf5SeImgaRM,,Dwayne N Jazz,"In today's Episode of Dwayne N Jazz we react to The Super Mario Bros. Movie - Official Trailer (Universal Pictures) HD and we jumped up as soon as we heard this trailer was out, and we have..."
Metallica: Lux Æterna (Official Music Video),https://www.youtube.com/watch?v=_u-7rWKnVVo,,Metallica,"Metallica's official music video for “Lux Æterna,” from the album “72 Seasons” available April 14th, 2023. Listen to “Lux Æterna”: https://metallica.lnk.to/LuxAeterna Pre-order...."
"New Gameplay Trailer: ""Let's Play Genius Invokation TCG!"" | Genshin Impact",https://www.youtube.com/watch?v=JUSZOjmD_1U,,Genshin Impact,"Introducing Genius Invokation TCG, the card game that's been taking Teyvat by storm! But let's not get ahead of ourselves. It's time to head to The Cat's Tail, and listen to what Diona has..."
Minecraft Players Simulate World Extinction,https://www.youtube.com/watch?v=iDKeDko9lPY,,Sipover,"In 30 days this SMP is going to be hit by a deadly asteroid, how will players react? HELP ME HIT 2.0 MILLION SUBSCRIBERS BEFORE THE END OF THIS YEAR! My Twitter: https://twitter.com/Sipover..."
Sounds for the Sideline | #NYGvsDAL | Dallas Cowboys 2022,https://www.youtube.com/watch?v=LTDpKbbrCGc,,Dallas Cowboys,#DallasCowboys #CowboysNation #NFL Subscribe to the Dallas Cowboys YouTube Channel: https://bit.ly/2L07gMO For more Cowboys content: www.dallascowboys.com Follow us on Instagram: instagram.com/dal...
MY REACTION TO THE NEW SUPER MARIO BROS MOVIE TRAILER - RogersBase,https://www.youtube.com/watch?v=KVgyO7rCayU,,RogersBase,MY REACTION TO THE NEW SUPER MARIO BROS MOVIE TRAILER! PRINCESS PEACH IN HER JUMPSUIT?! SETH ROGAN DONKEY KONG! EVERY EASTER EGG IN THE SUPER MARIO BROS MOVIE TRAILER TOAD HAD MY MOUTH WATERING!!...
ATEEZ(에이티즈) - 'Paradigm' Official MV (Performance ver.),https://www.youtube.com/watch?v=fNJMOR6x-4s,,KQ ENTERTAINMENT,[THE WORLD EP.PARADIGM] Release Date: 2022. 11. 30 12AM https://ateez-official.jp/contents/578544 ▶ ATEEZ JAPAN Official Homepage: https://ateez-official.jp ▶ ATEEZ JAPAN Official Twitter:...
Portugal vs. Uruguay Highlights | 2022 FIFA World Cup,https://www.youtube.com/watch?v=iV1OVKEMlTk,,FOX Soccer,Portugal and Uruguay faced off in their second matches of the 2022 FIFA World Cup. In the first half both teams struggled to score. Portugal's Cristiano Ronaldo was itching to get the ball...
"The Mean One - Official Trailer: Grinch Horror Parody (2022) David Howard Thornton, Krystle Martin",https://www.youtube.com/watch?v=XiFAtqmnXxU,,IGN Movie Trailers,The Grinch steals a lot more than Christmas in this forthcoming horror parody/sequel to the classic Dr. Seuss yuletide tale. Terrifer 2's David Howard Thornton plays the titular green meanie...
Night At The Museum: Kahmunrah Rises Again | Official Trailer | Disney+,https://www.youtube.com/watch?v=4WdSQFdMYZg,,Walt Disney Studios,"Get ready for one more crazy night. 🔦 Watch the new trailer for #NightAtTheMuseum: Kahmunrah Rises Again, streaming exclusively on Disney+ December 9. Night at the Museum: Kahmunrah Rises..."
FARMING BASE EXPANSION - Episode 2 - Minecraft Modded (Vault Hunters),https://www.youtube.com/watch?v=IpfyU7-8jPw,,iskall85,FARMING BASE EXPANSION - Episode 2 - Minecraft Modded (Vault Hunters) Iskall makes his ruined temple base bigger in this minecraft vault hunters episode. MODPACK: https://www.curseforge.com/minecr...
"I'm broke, I need 20,000 tiles | tileman #22",https://www.youtube.com/watch?v=5eR5IvmnKk8,,Settled,"5 likes perhaps? Play War Thunder for FREE on PC, PS5 and Xbox Series X|S. Download the game and get your exclusive bonus now: https://playwt.link/settled Support on Patreon - https://www.patreon..."
I Woke Up In Montego Bay In The Middle Of The Ocean 🌊 Happy 24th B-Day To Me🎊,https://www.youtube.com/watch?v=n7L7EHp4uOk,,Reginae Carter,@Armoney Lifestyle My Social Media: 💁🏾‍♀️Instagram - Itsreginaecarter 💁🏾‍♀️Twitter - reginae_carter1 Boxed In Streaming on peacock Tv ‼️ Hol’ it down single...
When You Finish Saving The World | Official Trailer HD | A24,https://www.youtube.com/watch?v=XbgJPKFxHXI,,A24,"SUBSCRIBE: http://bit.ly/A24subscribe From writer/director Jesse Eisenberg and starring Julianne Moore and Finn Wolfhard. WHEN YOU FINISH SAVING THE WORLD – In Theaters January 20, 2023...."
Deku VS Asta (My Hero Academia VS Black Clover) | DEATH BATTLE!,https://www.youtube.com/watch?v=xLvoGjTqSNs,,DEATH BATTLE!,My Hero Academia's Quirk-less hero goes up against Black Clover's magic-less mage in an underdog battle for the ages! Go to http://mintmobile.com/deathbattle to cut your wireless bill to $15...
P1Harmony (피원하모니) - 'Back Down' MV,https://www.youtube.com/watch?v=hE_I_HunRWQ,,FNCEnt,"P1Harmony (피원하모니) 5th Mini Album [HARMONY : SET IN] 'Back Down' MV 조화를 이루기 위한 방법은 다양하다. 진정한 조화의 시작은 서로 갈등을 겪어도, 더..."
Run BTS! 2022 Special Episode - 'RUN BTS TV' On-air Part 2,https://www.youtube.com/watch?v=ecsWfDLtoc8,,BANGTANTV,Connect with BTS: https://ibighit.com/bts http://twitter.com/BTS_bighit http://twitter.com/BTS_twt http://www.facebook.com/bangtan.official https://www.youtube.com/user/BANGTANTV http://instag...
Need for Speed Unbound Gameplay Walkthrough Part 1 - The Intro!,https://www.youtube.com/watch?v=kaGKuYXiEyw,,BlackPanthaa,Need for Speed Unbound is here! #eapartner we're jumping into our NFS 2022 gameplay starting with out Need for Speed Unbound let's play. Let's see what the game has to offer! ❱ Subscribe...
Film Theory: Sonic is Dying... of HUNGER! (Sonic The Hedgehog),https://www.youtube.com/watch?v=1scFuf0K9U0,,The Film Theorists,"New Holiday TheoryWear available! ► https://theorywear.com/ Okay Theorists, I have to ask: how can Sonic keep his super speed and not DIE?! Seriously, he should be STARVING! Based on his..."
Sami Zayn and Jey Uso are Ucey; Kevin Owens is not | WWE Raw Highlights 11/28/22 | WWE on USA,https://www.youtube.com/watch?v=EMWyEJfoSB8,,WWE on USA,Kevin Owens is still not buying Sami Zayn with The Bloodline. WWE Raw Highlights 11/28/22. Watch WWE Raw Monday nights at 8/7c on USA Network. WWE now streaming on Peacock. ►► SUBSCRIBE:...
[2022 MAMA] IVE&Kep1er&NMIXX&LE SSERAFIM&NewJeans - CHEER UP | Mnet 221129 방송,https://www.youtube.com/watch?v=d2heDnR3sjc,,Mnet K-POP,티빙에서 스트리밍 : https://tving.onelink.me/xHqC/30a78d6f 'LINNK the next generation' CHEER UP by IVE&Kep1er&NMIXX&LE SSERAFIM&NewJeans in 2022 MAMA AWARDS World’s No.1 K-POP...
"Popcaan - ""Next To Me"" ft Toni-Ann Singh (Official Video)",https://www.youtube.com/watch?v=nCkqzLNE9W8,,Popcaan,"Listen to ""Next To Me"": https://ovo-popcaan.ffm.to/nexttome Credits: Directed by: NABIL edited by: Damion Clayton DP: Alexander Alexandrov Color: Katherine Fox Vfx: Digital Axis Producer:..."
What went wrong with the Tube Map?,https://www.youtube.com/watch?v=jaEhvWXmLyk,,Jay Foreman,"Black Friday deal - Get Surfshark VPN at https://surfshark.deals/jayforeman Enter promo code jayforeman for 85% off and 3 extra months for FREE before 31st Dec SEE NEW EPISODES EARLY, AND..."
TERA RAID EXPLOIT - NEW FASTEST WAY TO FARM,https://www.youtube.com/watch?v=CwTRISverRQ,,BonusWolfe,Tera Raids have a HUGE exploit that allows you to get items and resources WAY faster
"GENDER REVEAL! After 3 Boys, BABY IS A.....!!!!",https://www.youtube.com/watch?v=bjy5bXIBIgw,,Earls Family Vlogs,"GENDER REVEAL! After 3 Boys, BABY IS A.....!!!! Make sure you SUBSCRIBE! ► http://bit.ly/SubToEarlsFamily ↪ Go follow me on IG to see the bump► https://www.instagram.com/rachelearls ..."
Salim's Wild 21st Birthday in Vegas!,https://www.youtube.com/watch?v=q53WWJz7T3E,,NELK,FULL SEND HOLIDAY DROP LIVE NOW: https://fullsend.com
Missing a punch in ANY fight,https://www.youtube.com/watch?v=ETSit2XvZjI,,CalebCity,I've seen people knock themselves out from their own attack. Music 19 - Oddwin
We Bought 3 Cheap Wrecked Exotic Cars For Less $$$ Than A C8 Z06 Corvette | Car Trek S9E1,https://www.youtube.com/watch?v=1nF2Uo2eVDA,,Tavarish,We DARE YOU to find better rebuilt exotic than we did on AutoTempest!►http://bit.ly/CarTrek901 Thanks to AutoTempest.com for sponsoring this series! ---------------------------------------------...
so I tried decorating for Christmas.. good luck charlie | Louie's Life,https://www.youtube.com/watch?v=co0szh-bvnk,,Louie's Life,This is my first time decorating for Christmas ALONE!! I was going through it last year.. emotionally. But this year I feel so much better and I'm READY! I went to home goods and hobby lobby...
Binging with Babish: Sausage from God of War: Ragnarok,https://www.youtube.com/watch?v=1tU6R3ySgpE,,Babish Culinary Universe,This episode is sponsored by Cash App. Download Cash App from the App Store or Google Play store today to add your $cashtag to the 80 million and counting. Click here: http://www.cash.app/download....
How Solar Panels Can Help Solve California’s Drought,https://www.youtube.com/watch?v=pCRX232VkBk,,Undecided with Matt Ferrell,The simple genius of solar canals explained. The first 100 people to use code UNDECIDED at the link below will get 20% off of Incogni: https://incogni.com/undecided. The southwestern U.S....
Touring Michael Jordan's Mansion!,https://www.youtube.com/watch?v=e6gb5VZF-3E,,Enes Yilmazer,"It is our great privilege to welcome you to the Michael Jordan Residence in Chicago, Illinois! Follow us on Instagram @EnesYilmazer , @AyersWorld ! Make sure to follow me on my 2nd channel:..."
Wales vs. England Highlights | 2022 FIFA World Cup,https://www.youtube.com/watch?v=ufIbJCJUoJU,,FOX Soccer,Wales and England faced off in their third matches of the 2022 FIFA World Cup. In the first half both teams struggled to score. Wales’ Daniel James received a yellow card in the 28th minute....
Metallica: Lux Æterna (Official Music Video),https://www.youtube.com/watch?v=_u-7rWKnVVo,,Metallica,"Metallica's official music video for “Lux Æterna,” from the album “72 Seasons” available April 14th, 2023. Listen to “Lux Æterna”: https://metallica.lnk.to/LuxAeterna Pre-order...."
The smartest dog in the world | 60 Minutes Archive,https://www.youtube.com/watch?v=tGlUZWNjxPA,,60 Minutes,"In 2014, 60 Minutes first attempted to answer the age-old question: does your dog really love you? #60Minutes #Dog #Dogs ""60 Minutes"" is the most successful television broadcast in history...."
Egg Drop From Space,https://www.youtube.com/watch?v=BYVZh5kqaFg,,Mark Rober,Next year we’re doing this on Mars. Ask for the CrunchLabs Build Box for Christmas and then let’s build some cool stuff together. Get the Holiday special two FREE boxes at https://crunchlabs....
3000 Days - [Hardcore Minecraft],https://www.youtube.com/watch?v=UdMFdwj03Xg,,Luke TheNotable,This video is intended for audiences 13+ years old for the following reasons Fantasy Violence Violent References Suggestive Themes Crude Humor Minecraft Hardcore Mode is the HARDEST version...
Lil Uzi Vert - Just Wanna Rock [Official Music Video],https://www.youtube.com/watch?v=UhbixyxgsiU,,LIL UZI VERT,Lil Uzi Vert - Just Wanna Rock Stream/Download - https://liluzivert.lnk.to/JustWannaRock Connect with Lil Uzi Vert: https://twitter.com/LILUZIVERT https://www.instagram.com/liluzivert/ https://www...
Deku VS Asta (My Hero Academia VS Black Clover) | DEATH BATTLE!,https://www.youtube.com/watch?v=xLvoGjTqSNs,,DEATH BATTLE!,My Hero Academia's Quirk-less hero goes up against Black Clover's magic-less mage in an underdog battle for the ages! Go to http://mintmobile.com/deathbattle to cut your wireless bill to $15...
[2022 MAMA] IVE&Kep1er&NMIXX&LESSERAFIM&NewJeans-ELEVEN+WADADA+O.O+FEARLESS+HypeBoy | Mnet 221129 방송,https://www.youtube.com/watch?v=IJks7TIDfnk,,Mnet K-POP,티빙에서 스트리밍 : https://tving.onelink.me/xHqC/30a78d6f 'LINNK the next generation' ELEVEN + WADADA + O.O + FEARLESS + Hype Boy by IVE&Kep1er&NMIXX&LE SSERAFIM&NewJeans in 2022...
Portugal vs. Uruguay Highlights | 2022 FIFA World Cup,https://www.youtube.com/watch?v=iV1OVKEMlTk,,FOX Soccer,Portugal and Uruguay faced off in their second matches of the 2022 FIFA World Cup. In the first half both teams struggled to score. Portugal's Cristiano Ronaldo was itching to get the ball...
"The Mean One - Official Trailer: Grinch Horror Parody (2022) David Howard Thornton, Krystle Martin",https://www.youtube.com/watch?v=XiFAtqmnXxU,,IGN Movie Trailers,The Grinch steals a lot more than Christmas in this forthcoming horror parody/sequel to the classic Dr. Seuss yuletide tale. Terrifer 2's David Howard Thornton plays the titular green meanie...
Season 2 Trailer | Overwatch 2,https://www.youtube.com/watch?v=rEJVOxzjyQ0,,PlayOverwatch,"The battle gets bigger in Season 2! On December 6, Overwatch 2’s first tempo tank Ramattra joins the fray, taking down enemies with his dynamic and lethal ability kit. Battle with or..."
Xscape Delivers Powerhouse Performance Medley Of Their Biggest Hits | Soul Train Awards '22,https://www.youtube.com/watch?v=TUIzDtzDzHI,,BETNetworks,"The 2022 Lady of Soul Award recipients Xscape delivered a powerhouse performance of their biggest hits including ""My Little Secret,"" ""Just Kickin It,"" ""Who Can I Run To,"" ""Tonight,"" and ""Understand..."
[2022 MAMA] Stray Kids - a strange incident+VENOM(MAMA ver.)+I AM MANIAC+MANIAC | Mnet 221129 방송,https://www.youtube.com/watch?v=0QKhAdN-keY,,Mnet K-POP,티빙에서 스트리밍 : https://tving.onelink.me/xHqC/30a78d6f 'Do you want to be ODDINARY?' a strange incident + VENOM (MAMA ver.) + I AM MANIAC + MANIAC by Stray Kids in 2022 MAMA AWARDS...
I found the best TIKTOKS,https://www.youtube.com/watch?v=-tpND_8cak4,,LazarLazar,🕹️ Download now for FREE: https://operagx.gg/LazarLazar Sponsored by Opera. Opera GX gives you complete CONTROL over your RAM & CPU usage. Kill CPU-draining tabs! 👕LAZAR Merch -...
Metro Boomin - Heroes & Villains (Short Film),https://www.youtube.com/watch?v=uI29qCR9PGk,,Metro Boomin,Pre-Save Heroes & Villains: https://MetroBoomin.lnk.to/HeroesandVillains Connect with Metro Boomin: https://twitter.com/metroboomin https://www.instagram.com/metroboomin/ https://www.instagram.com...
Lil Baby Ft. Nardo Wick - Pop Out (Official Video),https://www.youtube.com/watch?v=5jJJYYaw8vw,,Lil Baby Official 4PF,"Stream // Download ""It's Only Me"" here: https://QualityControl.lnk.to/ItsOnlyMe Follow Lil Baby Everywhere: Instagram: https://www.instagram.com/lilbaby_1/ TikTok: https://www.tiktok.com/@lilbaby..."
Can you beat two Mario games with ONE controller?,https://www.youtube.com/watch?v=C05Ldt9hDqs,,DougDoug,Get my Youtooz here! https://youtooz.com/products/chef-dougdoug This was streamed live on Twitch! https://bit.ly/DougTwitch Full stream recording: Edited by Berry Bebop! https://www.youtube.com/...
We Bought 3 Cheap Wrecked Exotic Cars For Less $$$ Than A C8 Z06 Corvette | Car Trek S9E1,https://www.youtube.com/watch?v=1nF2Uo2eVDA,,Tavarish,We DARE YOU to find better rebuilt exotic than we did on AutoTempest!►http://bit.ly/CarTrek901 Thanks to AutoTempest.com for sponsoring this series! ---------------------------------------------...
NBA YoungBoy - Hi Haters (official video),https://www.youtube.com/watch?v=3V8aen7Flhs,,YoungBoy Never Broke Again,YoungBoy Never Broke Again – Stream/Download: https://youngboy.lnk.to/MaIGotAFamily Subscribe for more official content from YoungBoy NBA: https://youngboy.lnk.to/Subscribe Connect...
"Tukoh Taka - Official FIFA Fan Festival™ Anthem | Nicki Minaj, Maluma, & Myriam Fares (FIFA Sound)",https://www.youtube.com/watch?v=rb0bjyt1OD0,,FIFA,"Stream Tukoh Taka ➡️ https://fifa.lnk.to/TukohTaka Follow #NickiMinaj, #Maluma, & #MyriamFares on social media ⤵️ Nicki's Twitter: https://twitter.com/NICKIMINAJ Nicki's Facebook:..."
Pokemon Violet is a stable game with no glitches at all,https://www.youtube.com/watch?v=yuLP8zSq4HY,,PointCrow,"Pokemon Scarlet and Violet -- the new Generation 9 Pokemon games, are absolutely ridiculously broken. So, I decided to do a playthrough of the games while attempting to break the game in every..."
Red Velvet 레드벨벳 'Birthday' MV,https://www.youtube.com/watch?v=Ut1OzEVUiM4,,SMTOWN,"Red Velvet's mini album ""'The ReVe Festival 2022 - Birthday'"" is out! Listen and download on your favorite platform: https://RedVelvet.lnk.to/Birthday [Tracklist] 01 Birthday 02 BYE BYE 03..."
Talking to Sam Bankman Fried,https://www.youtube.com/watch?v=0rL35_WV3lE,,Coffeezilla,"Sam Bankman Fried was interviewed on 11/16 and I worked with Tiffany Fong to release the audio, fact-check and comment on the contents of the interview. Listen to the full call here: https://youtu..."
Thanksgiving Stereotypes,https://www.youtube.com/watch?v=r1mhvegC6is,,Dude Perfect,"Thanksgiving Stereotypes… Love ‘em or hate ‘em, we all know ‘em! Thanks to our friends at Columbia for sponsoring this video! Get your Omni-Heat Infinity gear + Black Friday deals..."
Sami Zayn and Jey Uso are Ucey; Kevin Owens is not | WWE Raw Highlights 11/28/22 | WWE on USA,https://www.youtube.com/watch?v=EMWyEJfoSB8,,WWE on USA,Kevin Owens is still not buying Sami Zayn with The Bloodline. WWE Raw Highlights 11/28/22. Watch WWE Raw Monday nights at 8/7c on USA Network. WWE now streaming on Peacock. ►► SUBSCRIBE:...
space.,https://www.youtube.com/watch?v=MST-0jsOTN0,,Incognito Mode,Go to https://BuyRaycon.com/incognito for 20% off sitewide! Brought to you by Raycon. -------------------------------------------------- Ordinary Things: https://youtu.be/JEJ9Q3sUg3Q -------------...
Arcangel - JS4E (Official Video) | SEÑOR SANTOS,https://www.youtube.com/watch?v=rAr3-Pn9yRI,,Arcangel,Arcangel - JS4E | SEÑOR SANTOS Download - https://rimas.io/JS4E PRE-SAVE SEÑOR SANTOS ALBUM https://rimas.ffm.to/srsantos Subscribe to the channel: https://RIMAS.lnk.to/ArcangelYT #Arcangel...
"Last To Take Hand Off Jet, Keeps It!",https://www.youtube.com/watch?v=kX3nB4PpJko,,MrBeast,Close this and watch to the end to see who wins! New Merch - https://shopmrbeast.com/ At the end I said we would offset all carbon emissions but what we actually did was offset it by 10x!!...
Missing a punch in ANY fight,https://www.youtube.com/watch?v=ETSit2XvZjI,,CalebCity,I've seen people knock themselves out from their own attack. Music 19 - Oddwin
Tyler Adams responds to Iranian journalist over discrimination in USA,https://www.youtube.com/watch?v=x_Y5D_4eD_E,,Sky Sports News,► Subscribe to Sky Sports News: http://bit.ly/SkySportsNewsSub Ahead of USA and Iran's crucial World Cup fixture on Tuesday USA's Tyler Adams and Iran's Carlos Queiroz spoke to the media...
"Nas ft. @21 Savage - One Mic, One Gun (Official Audio)",https://www.youtube.com/watch?v=VMZefv4Vrwg,,Nas,"Nas ft. @21 Savage - One Mic, One Gun (Official Audio) King's Disease III Available Now 👑 Download/Stream King's Disease III https://nas.lnk.to/kd3 -----------------Nas-----------------..."
Taking Home Depot Workers to Disneyland!,https://www.youtube.com/watch?v=1NjSuxqVjuw,,Danny Duncan,Thanks for watching! Love you guys! Merchandise ▶ http://dannyduncan69.com Twitter ▶ http://www.twitter.com/DannyDuncan69 Instagram ▶ http://www.instagram.com/DannyDuncan69 Facebook▶...
I Put An Entire Ocean In The Nether In Minecraft Hardcore,https://www.youtube.com/watch?v=oQaHPZ4c1QE,,Kolanii,Grab some Kolanii Merch!! : https://www.kolanii.store/shop WATCH THE LAST EPISODE BEFORE THIS ONE (it explains a lot more hehe): https://www.youtube.com/watch?v=rFO1iqDpMZU&t=26s Watch more...
Gucci Mane - Letter to Takeoff [Official Music Video],https://www.youtube.com/watch?v=C2YSX4sV_bA,,Gucci Mane,Gucci Mane - Letter to Takeoff Download/Stream - https://guccimane.lnk.to/lettertotakeoff Subscribe for more official content from Gucci Mane: https://Atlantic.lnk.to/GMsubscribe Follow Gucci...
This Unhinged 90’s Movie Should Not Exist,https://www.youtube.com/watch?v=7gProq2rmag,,Kurtis Conner,"For 70% off with HelloFresh plus FREE shipping, use code 70KURTISTOWN at https://bit.ly/3h64Ywv! Found a movie called The Kid With X-Ray Eyes and it's even worse than you can imagine. Sorry!..."
Jung Kook from BTS performs 'Dreamers' at FIFA World Cup opening ceremony,https://www.youtube.com/watch?v=Jm29kLeWqDA,,FIFA,Relive Jung Kook's iconic performance of Dreamers as he was joined on stage by Fahad Al Kubaisi . Get all your World Cup content on FIFA+ 👉 https://fifaapp.onelink.me/nxRf/5a20ec7b Stream...
House of the Dragon - SNL,https://www.youtube.com/watch?v=TybjwLS1VtA,,Saturday Night Live,"Allies (Dave Chappelle, Kenan Thompson, Ego Nwodim, Punkie Johnson) of Rhaenyra Targaryen (Chloe Fineman) and Daemon Targaryen (Michael Longfellow) visit the couple at Dragonstone. Saturday..."
