Title,url,Thumbnail url,Channel,Description
Why Finland Joining NATO Checkmates Russia,https://www.youtube.com/watch?v=si9Phc9ArpU,,RealLifeLore,Get a HUGE discount on a 2-year plan with NordVPN: https://nordvpn.com/reallifelore It's risk-free with Nord's 30 day money-back guarantee! Please Subscribe: http://bit.ly/2dB7VTO...
Need for Speed Unbound Gameplay Walkthrough Part 1 - The Intro!,https://www.youtube.com/watch?v=kaGKuYXiEyw,,BlackPanthaa,Need for Speed Unbound is here! #eapartner we're jumping into our NFS 2022 gameplay starting with out Need for Speed Unbound let's play. Let's see what the game has to offer! ❱ Subscribe...
Salim's Wild 21st Birthday in Vegas!,https://www.youtube.com/watch?v=q53WWJz7T3E,,NELK,FULL SEND HOLIDAY DROP LIVE NOW: https://fullsend.com
GUESS THE GIRLFRIEND,https://www.youtube.com/watch?v=e1nUolN4G2w,,Preston,BRAND NEW PrestonPlayz Graphic Novel 🔥PRE-ORDER HERE http://bit.ly/PrestonSpookyHouse GUESS THE GIRLFRIENDwith Preston 👊 👕 MERCH - http://www.firemerch.com 🔥 NEW Fire Merch...
SUPER MARIO BROS. MOVIE TRAILER 2 REACTION!! Mario Kart | Donkey Kong | Nintendo 2023 Official,https://www.youtube.com/watch?v=XvvLmQJRsxA,,Reel Rejects,"THIS LOOKS SO AWESOME! The Super Marios Bros. Movie Official Trailer 2 Reaction & Review features plenty of EASTER EGGS & characters including Luigi, Bowser, Princess Peach, Donkey Kong, Toad,..."
I Spent 100 Hours in Pokemon Scarlet and Violet,https://www.youtube.com/watch?v=SJplE3R6xAM,,Nokimon,"I played Pokemon Violet for 100 hours... and found a lot of shiny Pokemon. 🍙 https://twitter.com/Nokimons for more :) If you like Pokemon Scarlet and Violet & shiny Pokemon, well hey....."
The Try Guys Make Pop-Tarts Without A Recipe,https://www.youtube.com/watch?v=RTJYRjnpfPo,,The Try Guys,"3, 2, 1… BAKE! We’re back and it’s all building to our LIVE finale. Tickets are on sale now at https://www.tryguys.com/WAR – get yours today and join us live in the Try Kitchen for..."
Letting Shane Control The Day… An Extreme 24 Hours In Our Lives,https://www.youtube.com/watch?v=LMdo2bxg-r8,,Ryland vlogs,Use code RYLAND for $20 off your first SeatGeek order. https://seatgeek.onelink.me/RrnK/RYLAND Watch Shane's new series!! https://www.youtube.com/watch?v=s3WFAONOFhs&t=2511s Intro song by...
I’ll Never Fight Again,https://www.youtube.com/watch?v=GuMvZW0BsxM,,Logan Paul,"Get the WWE Logan Paul Action Figure ► https://Creations.Mattel.com SUBSCRIBE FOR DAILY VLOGS! ► http://bit.ly/Subscribe2Logan Watch Previous Vlog (I Took 4,120 Polaroids In 99 Days) ►..."
